{
  "schemaVersion": "1.0",
  "synthetic": true,
  "description": "Synthetic: AzureWindowsBaseline present, CIS family has no assignment; families are never merged.",
  "snapshotAt": "2026-01-15T12:00:00Z",
  "machines": [
    {
      "machineId": "/subscriptions/00000000-0000-0000-0000-000000000000/resourcegroups/rg-synthetic/providers/microsoft.compute/virtualmachines/vm-synth-10",
      "name": "vm-synth-10",
      "kind": "AzureVM",
      "subscriptionId": "00000000-0000-0000-0000-000000000000",
      "resourceGroup": "rg-synthetic",
      "location": "westeurope",
      "osType": "Windows",
      "osName": "Windows Server 2025 Datacenter (synthetic)",
      "osBuild": "26100",
      "eligibility": "Eligible",
      "tags": {
        "owner": "synthetic-team"
      },
      "synthetic": true
    }
  ],
  "assignments": [
    {
      "assignmentId": "/subscriptions/00000000-0000-0000-0000-000000000000/resourcegroups/rg-synthetic/providers/microsoft.compute/virtualmachines/vm-synth-10/providers/microsoft.guestconfiguration/guestconfigurationassignments/AzureWindowsBaseline",
      "machineId": "/subscriptions/00000000-0000-0000-0000-000000000000/resourcegroups/rg-synthetic/providers/microsoft.compute/virtualmachines/vm-synth-10",
      "baselineFamily": "AzureWindowsBaseline",
      "guestConfigurationName": "AzureWindowsBaseline",
      "guestConfigurationVersion": "0.0.0-synthetic",
      "policyDefinitionId": "/providers/Microsoft.Authorization/policyDefinitions/00000000-0000-0000-0000-0000000000a1",
      "policyDefinitionVersion": null,
      "policyAssignmentId": "/subscriptions/00000000-0000-0000-0000-000000000000/providers/Microsoft.Authorization/policyAssignments/synthetic-assignment",
      "assignmentHash": "synthetic-assignment-hash",
      "parameterHash": "synthetic-parameter-hash",
      "contentHash": "synthetic-content-hash",
      "includeArcMachines": null,
      "complianceStatus": "Compliant",
      "lastComplianceStatusChecked": "2026-01-15T11:00:00Z",
      "synthetic": true
    }
  ],
  "reports": [
    {
      "reportId": "synthetic-report-57131192",
      "assignmentId": "/subscriptions/00000000-0000-0000-0000-000000000000/resourcegroups/rg-synthetic/providers/microsoft.compute/virtualmachines/vm-synth-10/providers/microsoft.guestconfiguration/guestconfigurationassignments/AzureWindowsBaseline",
      "machineId": "/subscriptions/00000000-0000-0000-0000-000000000000/resourcegroups/rg-synthetic/providers/microsoft.compute/virtualmachines/vm-synth-10",
      "baselineFamily": "AzureWindowsBaseline",
      "complianceStatus": "Compliant",
      "startTime": "2026-01-15T10:55:00Z",
      "endTime": "2026-01-15T11:00:00Z",
      "operationType": "Consistency",
      "configurationVersion": "0.0.0-synthetic",
      "checks": [
        {
          "checkKey": "synth-cis-001",
          "name": "Synthetic CIS-style control 001",
          "complianceStatus": "Compliant",
          "category": null,
          "severity": null,
          "benchmarkControlId": null,
          "reasons": []
        },
        {
          "checkKey": "synth-cis-002",
          "name": "Synthetic CIS-style control 002",
          "complianceStatus": "Compliant",
          "category": null,
          "severity": null,
          "benchmarkControlId": null,
          "reasons": []
        },
        {
          "checkKey": "synth-cis-003",
          "name": "Synthetic CIS-style control 003",
          "complianceStatus": "Compliant",
          "category": null,
          "severity": null,
          "benchmarkControlId": null,
          "reasons": []
        },
        {
          "checkKey": "synth-cis-004",
          "name": "Synthetic CIS-style control 004",
          "complianceStatus": "Compliant",
          "category": null,
          "severity": null,
          "benchmarkControlId": null,
          "reasons": []
        }
      ],
      "synthetic": true
    }
  ],
  "policyStates": [
    {
      "resourceId": "/subscriptions/00000000-0000-0000-0000-000000000000/resourcegroups/rg-synthetic/providers/microsoft.compute/virtualmachines/vm-synth-10",
      "policyAssignmentId": "/subscriptions/00000000-0000-0000-0000-000000000000/providers/Microsoft.Authorization/policyAssignments/synthetic-assignment",
      "policyDefinitionId": "/providers/Microsoft.Authorization/policyDefinitions/00000000-0000-0000-0000-0000000000a1",
      "policyDefinitionReferenceId": null,
      "baselineFamily": "AzureWindowsBaseline",
      "complianceState": "Compliant",
      "isCompliant": true,
      "timestamp": "2026-01-15T11:30:00Z",
      "synthetic": true
    }
  ],
  "exemptions": [],
  "expected": {
    "AzureWindowsBaseline": {
      "family": "AzureWindowsBaseline",
      "policyCompliance": {
        "compliant": 1,
        "nonCompliant": 0,
        "exempt": 0,
        "other": 0,
        "percent": 100.0
      },
      "checkPassRate": {
        "passed": 4,
        "failed": 0,
        "total": 4,
        "percent": 100.0,
        "reportsExcludedAsNotFresh": 0
      },
      "coverage": {
        "eligible": 1,
        "unknownEligibility": 0,
        "assigned": 1,
        "usableReport": 1,
        "freshReport": 1,
        "assignmentPercent": 100.0,
        "usableReportPercent": 100.0,
        "freshReportPercent": 100.0
      },
      "machines": [
        {
          "machineId": "/subscriptions/00000000-0000-0000-0000-000000000000/resourcegroups/rg-synthetic/providers/microsoft.compute/virtualmachines/vm-synth-10",
          "evidenceQuality": "Fresh",
          "reportedState": "Compliant",
          "green": true
        }
      ]
    },
    "CISWindowsSecurityBaseline": {
      "family": "CISWindowsSecurityBaseline",
      "policyCompliance": {
        "compliant": 0,
        "nonCompliant": 0,
        "exempt": 0,
        "other": 0,
        "percent": null
      },
      "checkPassRate": {
        "passed": 0,
        "failed": 0,
        "total": 0,
        "percent": null,
        "reportsExcludedAsNotFresh": 0
      },
      "coverage": {
        "eligible": 1,
        "unknownEligibility": 0,
        "assigned": 0,
        "usableReport": 0,
        "freshReport": 0,
        "assignmentPercent": 0.0,
        "usableReportPercent": 0.0,
        "freshReportPercent": 0.0
      },
      "machines": [
        {
          "machineId": "/subscriptions/00000000-0000-0000-0000-000000000000/resourcegroups/rg-synthetic/providers/microsoft.compute/virtualmachines/vm-synth-10",
          "evidenceQuality": "MissingAssignment",
          "reportedState": null,
          "green": false
        }
      ]
    }
  }
}
