{
  "schemaVersion": "1.0",
  "synthetic": true,
  "description": "Synthetic empty estate: every ratio is null, never 100%.",
  "snapshotAt": "2026-01-15T12:00:00Z",
  "machines": [],
  "assignments": [],
  "reports": [],
  "policyStates": [],
  "exemptions": [],
  "expected": {
    "AzureWindowsBaseline": {
      "family": "AzureWindowsBaseline",
      "policyCompliance": {
        "compliant": 0,
        "nonCompliant": 0,
        "exempt": 0,
        "other": 0,
        "percent": null
      },
      "checkPassRate": {
        "passed": 0,
        "failed": 0,
        "total": 0,
        "percent": null,
        "reportsExcludedAsNotFresh": 0
      },
      "coverage": {
        "eligible": 0,
        "unknownEligibility": 0,
        "assigned": 0,
        "usableReport": 0,
        "freshReport": 0,
        "assignmentPercent": null,
        "usableReportPercent": null,
        "freshReportPercent": null
      },
      "machines": []
    },
    "CISWindowsSecurityBaseline": {
      "family": "CISWindowsSecurityBaseline",
      "policyCompliance": {
        "compliant": 0,
        "nonCompliant": 0,
        "exempt": 0,
        "other": 0,
        "percent": null
      },
      "checkPassRate": {
        "passed": 0,
        "failed": 0,
        "total": 0,
        "percent": null,
        "reportsExcludedAsNotFresh": 0
      },
      "coverage": {
        "eligible": 0,
        "unknownEligibility": 0,
        "assigned": 0,
        "usableReport": 0,
        "freshReport": 0,
        "assignmentPercent": null,
        "usableReportPercent": null,
        "freshReportPercent": null
      },
      "machines": []
    }
  }
}
